bed_type,bathrooms,description,latitude,price,bedrooms,room_type,longitude
Real Bed,1,"Enjoy the privacy of having your own entrance and a floor to yourself in a newly-renovated Columbia Heights row house. One bedroom, one full bathroom, and a den are all yours and accessible via a private entrance. And of course you're welcome to use the kitchen and living room on the home's other floor.One bedroom includes two twin beds, while the den includes a sofa to accommodate one additional guest. Your floor of the row house also has a full bathroom with shower and a laundry room. A secure outdoor storage area is also available. Right outside your private entrance, there's a patio garden area with a table and chairs that is all yours to enjoy.We want to make your stay with us as comfortable as possible. We have several DC visitors' guides for you to use while you're here, along with information on how to get around the District. We even have a SmartTrip card for you to use on the Metro during your stay, and free passes for you to try out Capital Bikeshare and the DC Circulator.The home is situated in a walkable, lively neighborhood just one block from restaurants and shopping. The Columbia Heights Metro station on the yellow and green lines is just a five-minute walk away, and we've got a visitor's parking pass that will let you park for free on any nearby street.Stay at our place to experience a historic residential neighborhood that is close to all the tourist attractions (the White House, Capitol, and Smithsonian Museums are all just a short Metro ride away).At this time, we can only accept reservations from US citizens.",38.932571,56,2,Private room,-77.029083
Real Bed,1,"For $135/night stay in a beautiful upscale home 2½ Blks from Metro (Friendship Hgts, NW DC)If are you a non-smoker visiting DC and would enjoy the relaxed atmosphere of a home-away-from home, you will want to stay in this great home. Bring only your toothbrush, clothes and personal items. Exclusive use of a single-occupancy, light-filled, first floor room with its own cable TV, closet and bathroom, shower with frameless glass doors. Room emulates the comfort of a studio/den with leather chair, large dresser, new carpeting, twin bed/day bed for relaxing and sleeping. Owner lives in this spacious home which was remodeled and doubled in size a few yrs ago (4K ft). The home is beautifully decorated and located in one of DC's greatest neighborhoods -- quiet, tree-lined streets and close to everything, 3 Blks from the Red Line Metro. All towels and bedding provided as wells as dishes, pans & utensils. Visitors have full use of Meile washer/dryer. WiFi included. Full access to large landscaped Yard, Screened Porch and Deck, Great Room with 50"" HD Plasma TV linked to the Gourmet Kitchen (2 ovens, 2 refrigerators, 2 surface ranges, 2 refrigerators & microwave). LR/Parlor with fireplace and baby grand piano; lovely DR. Established neighborhood, friendly neighbors, close to all shopping, movies, restaurants, Whole Foods, Safeway, physician offices and more. Plentiful street parking with visitors pass. Plus -- the proprietor is awesome (haha). Garrison at 39th ((website hidden) map) ((website hidden)map)Location: Friendship Hgts, NW DCiPostingID: (phone number hidden)",38.95587180864318,88,1,Private room,-77.07942623543839
Real Bed,,"Come stay in the charming attic of my historic Queen Anne Victorian home. You'll enjoy total privacy, with your own full bath and large bed/sitter with sleeping (queen sized bed), working, and lounging areas. I'll provide a light continental breakfast, then you're off to explore all that Washington, DC has to offer. You'll be a 5 minute walk to the convenient Red Line of the Metro, as well as bus service all over the city. Zipcars and rental bikes are also close by, and you can pedal down the Metropolitan Branch Trail to Union Station, the Capital, and the Mall.If you're visiting Catholic, Trinity, or Howard University, or need to be at Washington Hospital Center, VA, or the National Rehabilitation Hospital, this is the place for you.Offstreet parking available.I have one cat, not allowed upstairs, but if you're terribly allergic this may not be the place for you. Also, the room is under the eaves, so there are some sloping ceilings. I assure you, though, it's charming and comfortable.I also have a Upright Steinway piano that you're welcome to play. You just may find yourself part of a jam session!",38.931864949299,59,1,Private room,-76.9963041482846
Real Bed,,"Enjoy a full size bed, flat-screen TV, wifi, and central AC in a historic rowhouse steps from shops, cafes, restaurants. Museums, monuments and downtown are nearby. Blocks from metro, abundant parking, easy access to highways. Can also provide pack'n'play and other kid friendly amenities.",38.88896769329585,75,1,Private room,-76.98416018864202
Real Bed,1,"The one bedroom, one bath fully furnished apartment in the lovely Glover Park area of Washington DC. In the bedroom you will find queen bed with comfortable pillows and fresh high-end linens. The full bathroom has a shower/bath and soft towels. The spacious living room has a large LCD flat screen tv&dvd, comfy couch (it is not a pull out, but very comfortable for one person to sleep on), desk, and a chaise. -Hardwood floors -All cooking supplies provided. -Towels and linens provided -Amazing rooftop views from the top floor of the building-Wireless InternetCentrally located three blocks from the National Cathedral, two blocks from Whole Foods, and a 20-minute walk to Georgetown. Ideal for sightseeing! Conveniently located on the bus route that takes you straight to the White House, museums, and the National Mall.",38.92464169394985,72,1,Entire home/flat,-77.07246426007966
Airbed,7,"This listing is for the AIR MATTRESS and/or COUCH in the living room (no private room). Guests may enjoy the living room, the bathroom (which includes a jacuzzi bathtub), kitchen, big screen HD TV with Tivo and HBO OnDemand, patio, in addition to an outdoor roof deck, an indoor gym, and an indoor lounge! Guests may use all appliances, including full use of the kitchen and cooking tools, a washer/dryer, cable, and wi-fi. This listing includes a big comfy wrap-around couch and a queen size air mattress in the living room of the apartment. It also includes a half bathroom separated from bedroom, for your ease of use. The apartment is all hardwood floors and is pet-free. We can help you figure out where to go or what to do--we've lived in the District for 5 years! The apartment is 4-5 blocks to either the Columbia Heights or U Street metros and is right at a bus stop on 14th Street, where the 52-53-54 bus line runs downtown very frequently! Both Columbia Heights and U Street have tons of restaurants, bars, grocery stores, etc. U Street is the District's best location for nightlife, entertaining both younger and older crowds. There are great spots for brunch, lunch, and dinner nearby. Logan Circle/14th Street is only a short (downhill) 15 minute walk away. And it is only a 30-40 minute walk to the White House or the National Mall area. There are several Zipcar pick-up spots within less than half a mile (including one right behind our building).Parking: DC street parking requires parking permits for long-term visitors. If you are interested in getting a permit, please let us know and we can help facilitate getting you a visitor's permit for $25. Otherwise, there is metered parking, a couple of parking garages, or you can take your chances and park on the street without a permit. Usually, they do not ticket you if you are there for just a couple of days.Our place is your perfect spot to get you to the best locations in the city, plus it comes with so many amenities to satisfy every need. From the gym (with treadmill, elliptical, weights, and cable) to the rooftop deck (for grabbing a glass of wine outside during the summer), you will love your stay here.",38.923051696521206,41,1,Shared room,-77.03046186792179
Real Bed,1,"The living space in this apartment is huge! The living room spans the front of the apartment, has a view of the Capitol and is the perfect space to host friends for a dinner party. In a pinch, out us also easily transformed to sleep another person on the fold-down couch or on an air mattress. The apartment is one of four units in a recently renovated old brick townhouse, and so the building itself adds a unique character. I will get you started with keys, in addition to any information you need regarding your stay in the District. My roommate and I have one of two bedrooms available. The first is a street-side bedroom with lots of natural light. It is slightly smaller than our fire escape facing bedroom, which has a desk as well. Street side is $90/night and Escape side is $110/night. Weekend nights are $130/night, regardless of the room you choose. Occasionally the whole apartment is available! When I'm out of town, Browse the calendar for dates where the whole apartment is available. While the apartment has ample space and comfort, the most special place about the apartment is its proximity to a historic part of DC that often hours overlooked when visitors make plans to explore DC. The apartment sits literally three blocks from 8th street in Eastern Market, with great restaurants and night life. The Marine Corps barracks at 8th and I street is the oldest base in the United States and hosts a free concert of the Marine Corps band every Friday night. During the day you can enjoy a huge craft fair and farmer's market, too!The neighborhood is safe and friendly. The apartment itself is next to a park, police station and library, and people in the neighborhood are warm and friendly. Eastern Market metro on the orange line or navy yard metro on the green line are the most convenient stops. The apartment also has ample street parking.",38.88114187754278,59,1,Private room,-76.99975620892387
Real Bed,1,"5 blocks from Capitol, perfect residential Capitol Hill neighborhood. Basement apartment two blocks from amazing restaurants and bars and 1.5 blocks to Eastern Market metro stop. Private Basement has one bedroom with a full sized bed that is 8.5' x 10', not including a good sized closet. The living room/ dining room/ kitchen area is 13.5' x 18' with tables and chairs and a twin sized bed. Central air conditioning and heating, washer/dryer, full sized bathtub, dishwasher and induction burner. All linens, plates, flatware, cutlery, cups, mugs, et cetera available on-site.Private patio - can be used as off street parking. Separate entrance through alley.In addition to the metro, there are several close bus lines.Two blocks from dining and bars of Barracks Row--Belga cafe, Matchbox Pizza, Cheasapeake Room, Ted's Bulletin, plus lots of cute little shops and, of course, the historic Marine Barracks! 7-11 and a little corner store and a Yes! Organic MArket also all 2 blocks away. Two blocks from dining at Pennsylvania Ave. -- Mr. Henry's, La Plaza, Fresh Express. Four blocks from the famous Eastern Market itself! The Capitol, Folger Library and Library of Congress are 5 -6 blocks away. Walking through beautiful, historic residential neighborhood.Easy freeway access off 395, just 3 blocks away. Navy Yard and National Baseball Stadium 9-12 blocks away.Peaceful park and small police substation across the street.",38.881961741278225,131,2,Entire home/flat,-76.9997465241938
Real Bed,1,"This is a huge and bright one bedroom apartment we just moved in. It is really spacious and has all you would need.It is 2 blocks away from the metro and with lots of shops of all kinds around. It is walking distance from Adams Morgan, U Street Corridor and Columbia Heights.It is located in the forth floor of a nice and old building, great vibe!There are a total of 6 windows, great views all around.There is a laundry room inside the building if needed.",38.9273938452717,69,1,Entire home/flat,-77.03437236438302
Real Bed,1,"A quiet, secluded, safe haven in the heart of the Washington, DC.Small bedroom for let on the 1st floor of an historic townhouse. Situated on the west side of DuPont Circle, in Kalorama, the safest neighborhood in DC.The bedroom has a separate entrance off the courtyard, is rustic, yet you have the thrill of gazing at the stars from bed. A small shared bathroom is located in the main living quarters, directly across the hallway from the bedroom. The DuPont metro station, the red line, and the main artery running through the city, and bus service, are both less than a half-mile away. They will quickly take you anywhere you want to go, including our nation's capital. Of course, taxi's and the more upscale Uber Cars, are everywhere.You are a short walk to hundreds of cafes and upscale restaurants DuPont, and it's an easy walk to Georgetown shopping.Included: Wireless internet, electric tea kettle and french press. Please Note:The listing includes the use of the bedroom and hall bathroom only, there is no access to the kitchen or outdoor areas. Also, the room is only available when the entire home has not been rented. Reservations typically cannot be accepted until a few days before your intended stay.",38.91498294368611,56,1,Private room,-77.04771742469813
Pull-out Sofa,,"This is a comfy fold-out bed in my apartment's living room. It's a six minute walk to the Cleveland Park metro station, restaurants, a grocery store, and shops. The National Zoo is one metro station away. I supply linens and towels. I have wireless internet, bicycles you can use, and a 32"" TV. Also I have a friendly cat. Looking forward to having you!",38.93990667491414,39,1,Shared room,-77.06014688794137
Real Bed,1,"2 Bedroom property in the prestigious Kalorama neighborhood of Washington in between Adam's Morgan, Woodley Park and Dupont Circle. It's right next to Kalorama park which has a trail, benches, and basketball courts. It's also next to 18th Street in Adam's Morgan which has a plethora of restaurants, cafes, shows, and nightlife. The property is located on the top floor of Kalorama row. It has vaulted ceilings, skylights, a small balcony, hardwood floors, marble countertops, steel appliances, two queen sized beds, queen sized air mattress and a large couch, and lots of floor space for DC. The White House is a 25 min walk away, Dupont circle is 10 min away, the zoo is 10 min away. The neighborhood is quiet yet close to many restaurants and nightlife in Adam's Morgan and Dupont Circle. It is in between the Woodley Park/Adams Morgan and Dupont Circle metro stations as well as a number of buses within a few blocks. Please check the calendar for availability and pricing. My flatmate and I travel quite a bit so there are three possibilities. 1. If both of us are gone, the whole apartment is available. ($150 per night) 2. If one of us is gone, 1 private bedroom is available in addition to the living room ($98 per night)3. If both of us are here (most of the time), the living room with a large couch and air mattress are available ($80 per night) The prices will reflect the differences. We also take a lot of last minute trips so there's a chance that you may have a bedroom even if you booked for the living room. *Given that my flatmate and I are both young, sometimes come home late, host parties, the place is probably not suitable for families (parents, children). My housemate Mak and I are super international and would prefer younger people around our age who are like minded. open and fun. We may invite you to parties, have you come out with us, etc.",38.919562862951146,52,2,Shared room,-77.04237810570424
Real Bed,2,"Clean, comfortable private room in a classic row house in Washington, DC coveniently located near public transportation. Guests enjoy access to a full bathroom, kitchen, washer/dryer, and Wifi. The location is convenient for anyone looking to explore DC. We are less than a block from public transportation, bicycle rentals, and a shuttle available to Union Station. Visitors to Gallaudet University will find our home particularly ideal as campus is right next door and both residents know ASL. We are also LGBTQ friendly. In your private room:-9ft by 9ft-New twin bed (linens provided) -Alarm Clock-Closet and dresser-Bright window-MirrorIn our home: -Full bathroom (towels provided)-Gally kitchen-Washer and Dryer-Wifi-Cable TV (In living room) -One friendly cat, SnoopOur Neighborhood:-Street parking available-public transportation less than one block -bicycle rentals less than one block-Gallaudet University less than one block.",38.90913782908917,47,1,Private room,-76.98817650120802
Real Bed,1,"Meticulously maintained modernist duplex in the middle of Columbia Heights in Washington, DC. The condo is 850 square feet, spread over two floors. The home features a beautiful chef's kitchen, exposed brick walls, and a private balcony off the bedroom.My home is just 2 blocks from the Columbia Heights metro (a green-line stop), a few blocks to groceries (at Harris Teeter, Giant or Target), and a 10 minute walk to U Street and Logan Circle (where the city's best restaurants are clustered). I'm 2.5 miles (or a 7 minute cab ride) to the front door of the White House and the National Mall where all of Washington,DC's monuments are located. (The address is 1444 Fairmont Street NW if you want to map it.)There's a 46-inch TV with AppleTV, Netflix, HBO Go, and a record player. Wicked fast wi-fi (though I don't have cable, so if you're planning to watch sports, you'll want to head to the sports bar around the corner). Also a washer / dryer in the unit if you feel like doing laundry.Columbia Heights in Washington, DC is a trendy neighborhood filled with newly opened bars and restaurants. I highly recommend Maple, Room 11, Wonderland or The Red Derby (if you're looking for an excellent dive) and Meridian Pint, all just a few blocks away. Logan Circle and U Street are just a few minutes walk away as well. I strongly recommend The Garden District (previously The Standard) if you're looking a beer garden experience and Le Diplomatte, Cork, The Pig or Pearl Oyster Dive for more upscale eating and drinking.",38.92347579247306,114,1,Entire home/flat,-77.03455368505705
Real Bed,1,Enjoy my beautiful sunlit studio with west facing floor to ceiling windows that lead out onto a balcony. There's a king bed and a pull out couch. It's only steps away from a grocery and metro station and a few blocks from the National Mall.,38.87930085935487,65,0,Entire home/flat,-77.01659071670964
Futon,1,"The couch: 35 INCHES WIDE, 6 FEET LONGVery spacious 1 bedroom condo - large living room with a couch that is basically a twin bed.Full kitchen available (use of Nespresso coffee machine encouraged!) 42' TV, CLEAN, 3 min walk to buses, 5 to GU campus, 7 to metroWood floors, Exposed Brick fireplace, 4 windows in living room I'm a young professional trying to pay off student loans... offering my couch as a way to help me out (and hopefully you too!) I will be in my bedroom, which is at the back of the condo so we are literally on opposite ends. We are separated by a door, but will share the bathroom - which I clean WITH BLEACH every 4 days. I basically only sleep at the place given my schedule, so you won't see much of me - I come home late and leave early. The street has been consistently voted number 1 in terms of walkability for DC - everything you would want is within reach including public transport, CVS, grocery store, etc etc. JFK and Jackie lived on my block, and he proposed to her at Martin's tavern - which is also on the block. Another neighbor on my block is a VERY FAMOUS new york times columnist. I can't explain how desirable the specific block is.",38.9068322625327,39,1,Private room,-77.07016149003928
Futon,1,"BRIGHT FULLY RENOVATED APARTMENT IN THE COOLEST PART OF DC...And in the most friendly& social young professional building.Few neighborhoods in Washington DC have the abundance of first-rate dining, shopping, arts, music and culture that locals enjoy along the trendy and vibrant 14th and U Streets.Spend some time here and live like a local in this cool and modern studio apt. in our neighborhood, minutes away from the U Street metro. The apartment is fully furnished .It includes :Open Space, Hardwood floors throughout, European-inspired kitchen with Granite Island,, innovative fixtures, 55 inches tv, new bathroom, central A/C. Bicycle storage in rear. Parking available for an additional monthly fee, or available free parking on the streetSteps away from U street and 14th street hustle and bustleCentral location close to everything: 1 block to METRO1 block away from the lively Meridian Hill Park ( outdoor free jungle beat performance at night, and free yoga class in the park on Sundays)3 blocks from Columbia Heights ( Target, Giant and the rest)25 min walk to Dupont CircleRental Bikes down the streetA Walk down the street to the most exciting restaurants& bars , in the cityBest musical venues Black Cat, 9:30, Howard theater farmer's market and everything you need is located within a blockI hope you will choose us!Pets considered. Chapin at 14th ((website hidden) map) ((website hidden)map)Location: 14th streetit's NOT ok to contact this poster with services or other commercial interestsThe nightly rate is $130AC, Internet and Cable included",38.92259066799936,78,1,Entire home/flat,-77.0340229820598
Futon,1,"My roommate and I are renting out our entry living room near Logan Circle. It's close to everything you could want: Five minute walk to green/yellow line, 10 minute walk to metro center. less than fifteen minute walk to Dupont, U-street, Chinatown. 10 minute walk to Whole Foods and all the bars/restaurants alone 14th street.We've got laundry for free in the apt, ironing, etc. You're welcome to use any of our appliances and dishes. There will even be some drinks and breakfast sandwiches for you. We have Wifi, a flat screen TV, you name it. We have a futon, love seat, or could blow up an air mattress if you're interested. We also have an AMAZING rooftop that is great to have a drink and watch the sunset or enjoy a morning coffee. Parking is pretty ample in the area (we could direct you a bit) and it's easy to find a cab. There is a great supermarket around the corner.",38.905666164702986,33,1,Shared room,-77.0263316555475
Real Bed,1,"Recently renovated basement apartment located on historic Capitol Hill just 2 block away from the Library of Congress and the Capitol. Apartment is walking distance to the Metro and a large variety of restaurants.This space has a semi open floor plan with crisp white decor to enhance the natural lighting.Access to Direct TV, Apple TV, wi-fi, and an abundance of local eateries.Interaction with guest will be on an as needed basis. We want you to feel at home with minimal interruptions. However, if you need assistance there is always someone available.Historic Capitol Hill neighborhood. Quiet and friendly.One block away from the Capitol Hill South Metro",38.88412723769218,98,1,Entire home/flat,-77.00423108741002
Real Bed,1,"The best neighborhood in DC! 1 block from Metro buses, short walk to Friendship Heights (redline) Metro train station, eateries and shopping everywhere - but the house is tucked into a wonderful, quiet neighborhood. Spacious 1300 square foot private apartment with a private entrance. . . not a typical basement apartment! This studio apartment is the entire ground floor of this historic home. The oldest house in Chevy Chase, DC - built in the 1890's.* Quiet, well-established and safe neighborhood* Kitchenette equipped with kitchen table all glasses/dishes and utensils* Microwave oven, toaster oven, Keurig and Krups coffee makers - stocked with coffee and stuff, double hot plate with pots/pans* Small-sized refrigerator, upright freezer access* Washer/dryer for exclusive use (detergents included)* Beautiful tile floor throughout* Window treatments for privacy* Bedroom full sized bed (w/set of linens) & arm chair (both from the Historic Watergate Hotel), Iron and Ironing board in the full closet* Antique dresser and mirror* Full living room suite (with a queen sofa bed for guests)*One and 1/2 bath with tiled shower (includes towels, hair dryer and soaps)* Home office area including a cabinet corner desk, chair, desktop computer, printer and free wireless access* Living Room has 60 inch flat screen TV w/ FIOS cable* Convenient walk to shopping, Metro (Friendship Heights), Metro bus, banks - EVERYTHING!* Beautiful piano (rare Kindergarten size, tuned and ready to play) and several other stringed instruments available for fun* Patio, gas grill, fire pit, picnic area w/ 7 person hot tub avail (w/notice) in privacy fenced-in back yard* Will offer private parking spot for additional $20 per day. (Zone 3 sticker req’d for street parking.)Enjoy the restaurants, post office, shopping, market, all within a couple blocksLooking for quiet, non-smoker(s), no pets",38.96668687108539,98,1,Entire home/flat,-77.07702426192303
