bed_type,bathrooms,description,latitude,price,bedrooms,room_type,longitude
Real Bed,1,"ROOM AVAILABLE- large master bedroom with lots of light, heater, air conditioner, fan, and drawers for clothes, with queen size (with memory foam mattress)bed available for spring and summer. MASTER BED IS $125/night for up to 2 people- no extra guests. Breakfast generally included.There is a small guest room also, but that is for one person only and available only at random times. Ask in an email if interested.1 of 3 bedrooms in row house on Capitol Hill NE/ H st Corridor area, just 12 blocks from Capitol, Library of Congress, Supreme Court, and National Mall; 1 block from bustling, hip, H st bars and restaurants; next to bikeshare station; close to public transit, arts center. music venues, and short walk/ride to Eastern Market. 2 parks nearby, lots of food, coffee, and drink options. Great location! Lots to offer and you can walk, bike, or take a short bus ride to all the sights- no need to deal with crowds or parking! House has a full bath upstairs and a 1/2 bath downstairs (shared with us); working fireplace,air conditioning units in each room, 2 living room areas (one for quiet reading, one with a giant TV), yard with table, chairs, garden (feel free to eat the berries and herbs), and hot tub (which we sometimes turn in to a cold tub in summer); wireless internet included; large TV with Netflix (again, shared with us); washer and dryer and weights in basement; and use of kitchen (shared). We will be staying in the other bedrooms and prefer someone (or a group) quiet and respectful. No party people please, although we are friendly and social.Price includes daily breakfast if we can work out times- vegetarian/vegan breakfasts (I use to run a brunch pop-up and I love to cook)More on the neighborhood: the site won't allow me to post links, but look up ""H street area,"" ""Capitol Hill,"" and ""Eastern Market"" to see our walkable/bikeable vicinity",38.89917,75,1,Private room,-76.991043
Real Bed,,"A huge room with a jacuzzi in its private bathroom, and a balcony. It's in the one of the best neighborhood in DC area, right next to the rock creek park.",38.94572399963596,65,1,Private room,-77.04482878849143
Real Bed,392,"Hello, my name is Seveer and I live in a quiet neighborhood near Capital Hill and the new H Street corridor. I am minutes from Union Station, Gallaudet University and downtown DC. I am looking for house guests to share my upscale 3 story, 3 bedroom townhome in NE DC. I have two spaces available. The first is a fully furnished, carpeted bedroom available with a queen size bed including a an attached den which includes a new 20” flat screen TV, ceiling fan, dresser, desk and a wardrobe closet, with a shared bathroom. The second is a newly remodeled basement, with hardwood floors, full hide-a-way bed, 42"" flat screen TV, fireplace, washer & dryer, (un-stocked) bar, private bath, and both include DirectTV, stereo and wireless internet access.My home has central air & heat and a new stainless steel kitchen. The front and back yards are fully gated and plenty of free street parking is available. I live near several colleges, with Metro access right out my front door for several bus lines or a fifteen to twenty minute walk to three different Red Metro Stations. I live five minutes from the Maryland line, ten minutes from the Virginia line and minutes from several major shopping areas and the interstate. Please send me a message if you have any questions. Seveer",38.905144,65,2,Private room,-76.985237
Real Bed,13,Private furnished room available for short-term or long-term stay!Welcome to access common areas as well.,38.92766502270268,36,1,Private room,-76.95854422569735
Real Bed,16,"Quiet neighborhood with lots of green space a room w/ walk-in closet in a 2-bedroom condo near Brookland! Parking available with a calm, friendly dog included for pet therapy. Near National Arboretum & access to fenced patio, just 10 min to Capitol Hill/Eastern Market; 15 min to DowntownBedroom available fits guests comfortablyWalk-in closet Spacious common areasFireplace and exposed brick wallsFenced Patio with a grillGreat park just a few steps away, with lots of relaxing reading and outdoor lounging space. Pool, tennis and basketball courts are also available.Several bus lines with direct routes to Brookland and Rhode Island Metro stations. If you have a car during your stay, parking is available.",38.92736073069724,33,1,Private room,-76.95820589093752
Real Bed,1,"This is a top floor 1000-sq ft penthouse apartment with panoramic views of DC, including a view of the Washington Monument from the couch. The apartment is a corner unit on the top floor of one of the 14th St corridor luxury buildings.10-ft floor to ceiling windows surround the living room allowing in enormous amounts of natural light throughout the day. Hardwood floors throughout the entire living area, carpet in the bedroom.The apartment is a 1-BR + den, and can comfortably sleep 4. The bedroom features a queen bed, and in the living room there is 1 full-size couch, 1 huge ten-foot couch and an airbed. Full kitchen with dishes, cooking amenities, washer/dryer in the bathroom.In the heart of the 14th St Corridor, the apartment is steps to some of the best bars and restaurants in DC. It's also a 7-minute walk to the U Street Metro station.Lobby of the building features a 24-hour doorman, lounge rooms with pool table, large fully equipped gym and a private movie screening room. The apartment also comes with access to the 2 building rooftops with 360-degree views of the DC skyline.",38.920456,147,1,Entire home/flat,-77.031517
Real Bed,,"Welcome to Washington's Eastland Gardens neighborhood, a quiet neighborhood conveniently located on Metrorail's orange line...with a deer-inhabited park right across the street. Stay here and you will be sleeping in a 19th century Victorian bed--with a very comfortable modern mattress--and dressing and working with an antique vanity and secretary desk. Guidebooks, and a variety of fiction and non-fiction are on the bookshelves for you to read. Relax at the end of the day in the parlor, and feel free to play the 1850s organ if you know how...or just want to try. In the winter, I'll often have a fire burning in the fireplace. If you like to feel the heat, stretch out with a book on a stuffed Moroccan pillow.In warmer weather, enjoy birdwatching or see the lily pads bloom just down the street at the National Park Service's Aquatic Gardens: http://www.nps.gov/keaq/The National Arboretum is just on the other side of the river. Breakfast will be served in the Victorian dining room.There is plenty of free parking in front. All-day parking at the Minnesota Ave. Metro station (0.7 miles away) for $3.25. Weekends only, two night minimum.",38.906264858154415,65,1,Private room,-76.94523577296376
Pull-out Sofa,1,"I have a 1200 sq. ft., one bedroom flat in the heart of NW DC's Glover Parking. This accommodation consists of a patio, living and dining space, full size kitchen, 1.5 bathrooms, and 1 bedroom, and washer/dryer in the unit.The uniqueness of this living space is that that master suite is able to be shut off from second half of the flat. The living space is host to two sofas and a love seat, of which the sofa's are convertible sleepers. The kitchen is a full size, standard with modest appliances available for the chef you.Each guest looks forward to a comfortable stay with full access to all amenities of the flat. The neighborhood includes various high- and low-end restaurants and immediate metro bus access to the various tourist points of Washington, DC and the boutiques of Georgetown.My place is unique because it boasts expansive sq. ft. which aids in guest comfort.",38.92109278799383,46,1,Shared room,-77.06955052812177
Real Bed,1,"Beautiful, cozy two bedroom with lofted lounge/3rd bedroom area in the heart of Columbia Heights. Sliding glass doors lead to a 3rd floor terrace with seating for two and an herb garden. Bedrooms are spacious, clean, and decorated in a funky rustic sort of way, and they both get lots of natural light. Kitchen is GREAT for cooking and fully stocked; kitchen table seats 6.The apartment is located just 3 blocks from the Columbia Heights metro, where there are also abundant food options, Target, and grocery stores. A short walk to great bars and restaurants in the U St area, the 11th St strip, Mt. Pleasant, and Adams Morgan.We have wireless internet and a cable TV. The beds are a queen size in the smaller bedroom and a full size in the bigger bedroom. We also have a comfortable air mattress that sleeps two for the lofted area, so this apartment can accommodate at least 6 without feeling cramped.As to street parking, there is a two hour limit for non-residents outside of our building, but we can assist with getting you a temporary parking permit for the time that you're here.",38.923718178222906,163,2,Entire home/flat,-77.03057024705554
Real Bed,1,"Come share our home in Northwest DC. We have a fully furnished bedroom with a private bathroom in our basement. The room has a full bed, table and chairs and a television complete with Netflix streaming and an XBox 360 (no cable TV though). The bathroom has a shower. Easy access to a washer and dryer. All sheets and linens will be provided.The house is located in Brightwood DC, a small community north of Petworth, south of Silver Spring and west of Takoma Park. We have ample street parking and are a 10-15 minute walk to the Takoma Metro station (Red Line) and just two blocks from bus lines along Georgia Avenue. We're also one block from a grocery store (Safeway), two blocks from a drug store (CVS), three blocks from a recreation center and close to Rock Creek Park. and the former Walter Reed Hospital. You'll have access to our kitchen, backyard patio and garden. We're a young, married couple who work in the arts. Our antisocial cat may think otherwise, but we're looking forward to welcoming you to Washington, DC.",38.9688082230919,49,1,Private room,-77.02498382774945
Real Bed,,"Meticulously renovated, one-bedroom apartment in historic brownstone. Fully furnished and beautifully appointed one-bedroom apartment on ground floor of home boasts Italian tile floors throughout full-sized bed in bedroom, sleeper sofa in living room, W/D, AC, DW, built-in microwave, incredible sunlight and top of the line furniture, furnishings & bedding. Lovely landscaped garden surrounded by wrought-iron fence off of living room. ALL utilities included: WiFi, electric, gas, water, cable & security system. Weekly maid service available upon request.Guests need only arrive with clothing & personal items to begin enjoying a luxury hotel-suite living experience. Owner owned & managed.",38.9279250602999,114,1,Entire home/flat,-77.03008381536239
Real Bed,,"Meticulously renovated, one-bedroom apartment located within one block of DC METRO.Fully furnished and beautifully appointed one-bedroom apartment boasts 11-foot ceilings, queen-sized bed, W/D, CAC, DW, built-in microwave, Italian tile in kitchen & bath, hardwood floors throughout, custom closet and built-ins, incredible sunlight and top of the line furniture, furnishings & bedding. Wrought-iron terrace off of living room provides access to landscaped garden. ALL utilities included: WiFi, electric, gas, water, cable & security system. Weekly maid service available upon request.Guests need only arrive with clothing & personal items to begin enjoying a luxury hotel-suite living experience. Owner owned & managed.",38.92885315543696,114,1,Entire home/flat,-77.03002875698736
Real Bed,1,"PERFECT and save neighborhood. 4 blocks from Dupont metro, 2 blocks from Wholefoods, starbucks, yoga studio, bars, restaurants, 5-10 walk to National Mall, embassy row.Building: Front door security, gym, roof, laundry, grocery storeApartment/Studio: Flatscreen TV, Highspeed Wifi, Central AC, double bed, futon, full kitchen and bathroom",38.90606679447586,98,0,Entire home/flat,-77.03558900621714
Real Bed,1,"Enjoy the convenience of having everything you need within walking distance. Walkable to many major DC attractions (National Mall, White House, nightlife), as well as all the city's metro lines and several buses and the Circulator system. Extremely quiet building makes for relaxing refuge at day's end!Note - I will post more/better photos in the next few days.There is a plant-filled balcony perfect for enjoying a meal or glass of wine outdoors. Located one block from 14th Street, which boasts numerous restaurants and shopping locations, and you can also walk to take advantage of the vibrant nearby neighborhoods of Dupont Circle, U Street, and Adams Morgan. All the metro lines - blue/orange, yellow/green and red - are within an easy walk. This is a safe location right in the heart of the city. My preference is for a guest/s that will be able to stay for at least two weeks, hence the discounted monthly rate.The apartment comes fully furnished with linens and towels, a full kitchen, washer and dryer in unit, wireless internet, cable, and a DVD player.I will be available by email during your stay, and I will also provide for a local contact by phone should any problems arise.",38.90924211398576,98,1,Entire home/flat,-77.02998216191746
Airbed,,"Comfortable queen air mattress in private room with flat screen TV, computer, and full bath. Please enjoy the common area, kitchen, rooftop pool, downstairs business center, coffee bar, gaming and conference rooms. Easy walking distance to the U St. Corridor and metro.",38.92037631414127,88,1,Private room,-77.03224455593904
Real Bed,1,"We have a two-bedroom, one bathroom row house one block from the Shaw/Howard Metro stop in Washington DC. It is a perfect location for anyone that wants to be close to transit, and is a short walk to the convention center, U-Street neighborhood, Chinatown, and Logan Circle. My wife and I live in the other bedroom, and love showing people fun things to do in our city.",38.91431034260232,82,2,Private room,-77.01964547106815
Real Bed,,"We are renting a private bed and bath in our brand new rennovated townhouse in Washington DC's Petworth neighborhood. The room has a double bed and private bathroom. Guests have a choice of several breakfast options, and use of the backyard, living space and washer/dryer for the duration of their stay. There is street parking available.The house is located just off of Georgia Ave, only a 10 minute walk from the Georgia Ave Petworth metro stop, close to Yes! Organic Market, Capital Bikeshare and new restaurants, including Domku and Chez Billy.A perfect repose from DC sight-seeing, or a great alternative to a hotel on a business trip to DC.",38.94365707024977,82,1,Private room,-77.02457027502089
Real Bed,1,"One-bedroom apartment in newly renovated, historic row house. Tree-lined street just three blocks away from lively U Street corridor. Apartment has open-layout, lofted ceilings, wood floors, granite counter-tops, air-conditioning, and new furniture, including pillow-top, queen-size bed and flat-screen TV with cable and internet, and fully equipped kitchen and bar. You'll have your own personal balcony and street parking is available.In the heart of DC--very close to Metro stop ""U Street"" and ""Colombia Heights"" (green/yellow line) or easily take the Circulator bus (10 minutes) or walk to the National Mall, monuments, Smithsonian museums, or Adams Morgan, Dupont Circle, Georgetown, and Downtown neighborhoods. U Street neighborhood has tons of unique restaurants bistros, eclectic shops, live music, theater, and art. An absolutely prime location in DC and a perfect sized flat for a couple looking for a DC getaway. .",38.925058789618674,96,1,Entire home/flat,-77.03065833730463
Real Bed,1,We offer 3 bunk beds in a room with cable TV and wifi plus bathroom. Washer/dryer access and small kitchen. 2 blocks from Navy Yard Metro (Green Line) and 10 mins walk to US Capitol (Blue/Orange line).Please let us know how you will be arriving in Washington and we can advise on best ways to reach this destination. It is possible for us to meet you at Reagan National Airport or Union Station. For rides from IAD or BWI we charge $50.,38.87656052937834,31,1,Shared room,-77.00127925600728
Real Bed,1,"Make your DC visit an unforgettable experience by staying in this gorgeous apartment in the District's best neighborhood, Adams Morgan. Located at the heart of Adams Morgan on the top floor of the area's tallest building, this stylish apartment is within walking distance of:-the city's best restaurants;-night life (clubs and bars);-easy red line metro access;-shopping and grocery amenities;-area attractions like Rock Creek Park and the National Zoo.Wake up in our large, sunny bedroom with two large windows facing south and west. With views of the district and National Cathedral, you'll enjoy natural all day sun, wonderful breezes and city sounds through open windows. The one thing you won't hear is a neighbor--with no one above and only one shared wall, this serene apartment is all sun and city soundscape. Make use of all the kitchen appliances (with a large window overlooking Rock Creek Park) you'll need for a delicious breakfast in bed or hot cup of morning joe to start your days in DC. Even the bathroom in this beautiful top floor apartment has two windows overlooking the National Cathedral and Rock Creek Park--but don't worry, you're too high up for them to see you! :) Amenities include:-50"" Smart Samsung flat screen with BlueTooth keyboard;-PlayStation3 and games;-Free WiFi;-Free streaming Netflix subscription access;-Air conditioning with remote control;-Complimentary laundry card and access;-All gourmet kitchen appliances including coffee maker, toaster, rice cooker, blender, and Magic Bullet;-Gated entry with weekend security;-Metro and Capital Bike (four) stations nearby.",38.92260901423889,101,1,Entire home/flat,-77.04413977155968
Real Bed,2,"This 1200sq ft Condo is literally in the heart of everything in DC and the hip Chinatown neighborhood. Something like 40 restaurants are in a 4 block radius and you're only 3 blocks to the national mall, monuments, museums, and the White House. Plus the place has a (phone number hidden)p Hi-Def projection TV. There's nothing not to love. Internet, cable, yes, yes. We have it all. The apartment has 2 bathrooms, one bedroom and a huge red couch that sleeps 3 more (seriously)A few words of warning about some of the other AirBnB listings. There are a large number of listings on Massachusetts Avenue. Mass Ave is about a block or two from some undesirable parts of town and not close to anything. I think, given the number of listings, that they may be un-rented units in an Apt building up there. Not convenient!The unit listed at the Newseum is a good one and the unit listed around 912 F Street is a good location also.The advantage of this Condo besides all the things to do in walking distance from here is that you have every metro (subway) line available to you only 1 block away. Metro center is 1 block west which has the Red, Orange, Yellow and Blue lines, and Chinatown Metro Stop has the Red, Yellow, and Green line. Like I said... ""Perfect"" location!",38.897476654654994,294,1,Entire home/flat,-77.01604817253886
Real Bed,1,"A cozy apartment in a once-upon-a-time house, our NE home is comfy and cozy and only minutes away from the bright lights downtown Washington, DC. Ok, maybe the lights in the District are not all that bright, but there's still plenty of fun to be had! The apartment is a 2 bedroom, one-story layout. The ability to rent the whole apartment (both bedrooms) is available upon request. The house is situated just across North Capitol Street in the neighborhood of Eckington in the NE quadrant of the District. We're just a couple blocks from Bloomingdale: a quaint, family-oriented neighborhood with local favorites like Big Bear Cafe, Boundary Stone Brewery, and Rustic Pizza. We're also just a few blocks (about a 10 minute walk) to the Rhode Island Metro (red line), which will take you straight downtown to the restaurants of Chinatown, the shopping of Metro Center, or the people watching of Dupont Circle.",38.91610240748875,45,2,Private room,-77.00369167804392
Real Bed,1,"Welcome!!! Great place to stay in Washington, DC at anytime. Fall, Winter, Summer, or Spring!!! Clean house, high speed internet, cable. Did I mention the hardwood floors? I have a nice furnished room which has: a queen size bed, dresser, window, desk, mirror, closet, fresh sheets & towels.The bathroom with shower is a few steps away. Enjoy yourself in the common areas: large chef kitchen & living room.14th Street Heights!! Close to Rock Creek Park!! Tennis Courts!! Walking Trails!!Just a 4 minute bus ride to Walter Reed Army Center,10 minutes away from Downtown Silver Spring, & 20 minutes away from downtown DC. Only 6.23 miles from the White House, You can take a walk to the Carter Baron or play tennis at the William H. G. Fitzgerald Tennis Center. Central Air makes it wonderful in the summer. Catch the bus down 16th or 14th Street. Catch the short bus ride to the Columbia Heights Metro. Search the Washington Metro Transit Authority website so that you can plan all of your trips via Metro bus, Metro Rail or by both.I am not close to a metro but don't underestimate the power of buses to get you around... If you are driving, I have a free street parking for you. The closest airport is Reagean, but Dulles is usually cheaper.Quiet, respectful house seeking the same in our guests!!",38.96025390922216,42,1,Private room,-77.0327652299506
Real Bed,1,"This is a private bedroom in a 2 bedroom / 1 full bath apartment. Bedroom is approx 9' x 9', with full size bed and with desk. Apartment is brand new/renovated, and features granite counter tops, stainless steel appliances, and hardwood floors.Apartment is located in the heart of the Logan Circle/Shaw neighborhood. Less than 5 minute walk to the best nightlife in the city (U Street), and the Shaw Metro station on the yellow line, 15 minute walk to Dupont. Lots of neighborhood brunch spots, shops and parks all within walking distance. Go beyond the monuments and experience true DC culture without all the tourists!Unique feature: a movie-theater style popcorn machine.",38.914374010386474,65,1,Private room,-77.0252977630524
Real Bed,1,"Lovely, cozy and quite private room and bath with private rear entrance. Private off street parking with gated remote control access. Located in a beautiful and peaceful single family home just 5mins from Capital Hill, and one block away from public transportation. TV with DVD and a good selection of movies. Clean sheets, towels, soap, shampoo, lots of tourist maps/info, etc provided for your stay. Mini fridge and microwave. Just 15mins bus ride away from museums, downtown shopping, great restaurants and entertainment. The front and back yards are fully gated and well lite. 20min walk to the Blue & Orange Metro Lines.Host will be happy to help with providing guest with great places to dine and visit that will give the guest a feel for all top spots that only the locals know about :-) Home is owned by a professional designer and has been featured in several local and national publications.Free: Wi-FiDirect TVLocal & National CallingCleaning Service for guest staying over 7 daysLaundry Service for quest staying over 7 days (upon request)",38.869133868907305,65,1,Private room,-76.96550362894155
Real Bed,1,"Master bedroom, kitchen, living room with 60"" Flat TV, leather sofas, 101 year old renovated house near everything in DC.",38.92608439333426,49,1,Private room,-77.02312853072364
Real Bed,0,"Welcome to the Hills of Anacostia Hideaway II.You have found a private room in a single family home in the Historic Anacostia Washington, DC neighborhood. Located less than 3 miles from both the newly built Washington Nationals Baseball Stadium and the US Capitol. It takes approximately 10 minutes to walk from our home to the Anacostia Green Line Metrorail stop; 5 minute-walk to the Frederick Douglass House, less than a 10 minute metro rail ride to Smithsonian museums and other sites; and less than a 7 minute drive to downtown DC.To see just how close our neighborhood is to other parts of D.C. please check out the Washington Metropolitan Area Transit Authority website and use the Anacostia Metro Rail stop as your starting point.$90 per night for a single guest; plus $15 for an additional guest.You will have access to a bedroom with a private half bathroom. Showers can be taken in shared bathroom. The room is well lit and features a queen sized bed w/ microwave, refrigerator & closet. There is access to dining room, living room, kitchen, and laundry room in the basement. Basement also has its own entrance.Verizon Fios Wireless Internet/WiFi and cable TV and unlimited national long distance.We do have a cat and we allow you to bring your pets for an additional fee based on size and type of pet.We have a large private fenced in backyard that has space to lounge and BBQ.We will not accept any reservations from people who have not completed an AirBND profile. When sending your inquiry please state why you are visiting DC, your length of stay and any special requests and/or needs.On arrival, you must provide a government issued photo i.d. such as a driver's license or passport and emergency contact information.Once you have a confirmed reservation, please read our AirBNB house manual for all other details.We look forward to possibly hosting you!Note: Airbnb keeps accurate track of dates of availability, so please use the site (rather than a note to me) to see if the dates that you are interested in are available. Please do not hesitate to ask about anything that is not clear.",38.860039732249554,59,1,Private room,-76.98950297017042
