bed_type,bathrooms,description,latitude,price,bedrooms,room_type,longitude
Real Bed,1,"Rent the 2br/1ba apartment! The apartment is clean and comfortable. We're conveniently located in the heart of Adams Morgan (known for its robust nightlife, restaurants and boutique shops), just steps from Columbia Heights, Dupont Circle, and downtown DC with very accessible public transportation. Capital Bikeshare (bike rental) and ZipCars are located within a block of the property. Street parking is available, but not reserved.There's plenty to do with all the popular destinations closeby. The neighborhood is very trendy with a plethora of restaurants, bars, and shopping within walking distance. With great shopping options in Columbia Heights, the White House and National Mall just 2 miles away and a 10 minute walk to the National Zoo, our property in Adams Morgan is the most convenient and affordable option when visiting Washington D.C.The spacious rooms are both full of natural sunlight, with captivating views of the city. Each room has it's own private kitchenette equipped with a refrigerator, stove, coffee maker and other kitchen items. Free wifi and access to washing machine is also available.ABOUT GETTING AROUND:Free neighborhood and subway maps available. You can easily plan your trip using the Metro Trip (email hidden). Airport/Amtrak shuttle and tour services available nearby.We are quick to respond, so write us with any questions!",38.92407888924465,104,2,Entire home/flat,-77.04199074445094
Real Bed,1,"Seven minute walk to the extremely popular U Street corridor and metrorail and 8-minute walk to the newly fashioned Columbia Heights neighborhood and metrorail. Every type of store you will ever need during your stay is located within 8 minutes of walking: Dozens of eateries, restaurants, fitness centers, and retail such as Target, Best Buy, Marshalls, Washington Sports Clubs, Chipotle, Starbucks, 7-11, Baskin Robbins, Dunkin' Doughnuts, Subway, Quiznos, Ben's Chili Bowl, and other local and unique eateries are within walking distance, as well as UPS & FedEx shipping centers. Not to mention, the insanely attractive nightlife activities galore...Dozens of lounges, bars, clubs, jazz, and mixed music venues are all here! Currently, there is only one big screen HDTV in living room that is shared, but includes XBox gaming console, cable, internet, phone, and DVR recording capabilities. All electric. Balcony overlooking the city includes a panoramic view of the US Capitol and Washington Monument. The property is secured, and access controlled 24/7 by locked gates and fences that require use of an electronic fob which can be loaned to you during your stay, if desired. The property is patrolled by armed security officers during the evening hours. There are two elevators to get you to the unit floor and washer and dryer units across the hall from the elevators on the same floor.I will personally give you a one-hour intro/tour to the property and/or city, if desired. I will make sure your stay is completely comfortable and enjoyable. Unfortunately, parking is limited to street parking, but Metro access is great. An additional $50 will be added for all guests who desire to use the electronic fob for building entry. Otherwise, you can just use the intercom system and wait for access.Here, you've got it all!!",38.921404149214595,65,2,Shared room,-77.03121589328047
Real Bed,1,"Lovely furnished room in quiet spacious nonsmoking NW DC house, just three blocks walk from the Takoma metro station on the red line. See (website hidden) for details of travel from the Takoma metro to sightseeing, your internship, etc.",38.97362716710699,39,1,Private room,-77.02064252180918
Real Bed,1,"The room is available right away.The room for rent is located in one of Washington DC's most hip and fun neighborhoods: Columbia Heights. The room is very big (20 x 15) and has a queen bed, very big closet, several bookshelves and bookcases, lamp, AC window unit, ceiling fan and 2 large windows that look out to the street and you still have more than plenty of space to walk around.The house is a row house with three bedrooms, basement, 1 full bathroom, dining room, living room, a sort of skinny but full kitchen, wood floors, and laundry room with washer and dryer. There's also plenty of space for storage in the basement if you need to have something there. We have a front porch and back porch. There's also space for a car and/or for a fire pit. Additionally, we have wireless internet.The occupants of the house are 2 25-year old girls who are very friendly and nice. Everybody at the house gets along and will do everything in their power for you to feel welcome.We all work in different industries so our schedules are quite different but we always find sometime to sit down and catch up. If you are shy, introvert or just like to keep yourself to your room that's cool too. We are very respectful of everybody's opinion and try to keep communication flowing.As for the location, the house is a block away from a 24/7 convenient store, and 3-4 blocks to a few well-known bars in the area which are always fun, including my favorite one, Wonderland Ballroom ( (website hidden)/yelp it) We are only 6 blocks away from the Columbia Heights Metro and all the big stores such as: Target, Marshall's, Giant (Grocery store open 24/7), Bed Bath & Beyond, Best Buy, etc. Additionally there's all kind of restaurants around there too such as: Chipotle, Kava, Potbelly, Five Guys, Chinese, Papa John's Pho 14,The Heights, Thaitanic, Taqueria D.F, etc. In all it's honestly one of the best locations in the city.Please feel free to email us with any questions you might have.Thanks Julienne and GreerP.S: So much more to say about the house, occupants and whatnot but it would be too much to write here so ask away!! :)",38.929276600269645,46,1,Private room,-77.01917389686011
Real Bed,1,"Amazing and generously laid out 1 bedroom apartment on the ground floor of a west end town house with one parking space. Newly remodeled with plenty of space for two people to share and entertainment in the living room. Great city pad!. Walking distance from the World Bank, IMF and GWU. 2310 L street is convenient to the great shopping of Georgetown, the amazing nightlife and restaurants of DuPont Circle and downtown, and the Foggy Bottom metro station. The circular bus to all these locations stops right in front of the apartment. It is the perfect location. Ideal for short term consultants working at World Bank, IMF, GWU or Fed Govt.",38.9023278163562,118,1,Entire home/flat,-77.05142312167955
Real Bed,,"My couch is your couch (or if you need a more private situation, I can stay with friends while you take over the whole apartment for a bit more). There is parking in the back (a tandem spot shared with me, but I don't drive much so it's pretty easy to just back out and I'll park in the deeper space). On a great residential street in Adams Morgan, walk to yoga, organic grocery, restaurants, the metro, rock creek park, etc. I'm a relaxed yoga teacher, I don't stay up that late at night, rise by 8am. Vegetarian food in the home only please. Thanks!",38.92160913637055,59,1,Shared room,-77.0393561620241
Real Bed,,SINGLE FAMILY HOME - PARKING ON THE SIDE - ON A BUS LINE FOR TRAVEL -,38.848739311144925,82,1,Private room,-76.97829531415796
Real Bed,1,"Located just a short walk from H St. NE corridor this modern, upscale condo is surrounded by great food, arts, and entertainment. The unit is beautifully furnished with a queen sized bed, a full bathrooms, and includes such amenities such as a 47"" flat screen television and a modern kitchen with upgraded appliances. We will not share the home with you during your stay, so you can expect plenty of privacy.The condo is convenient to several Metro Bus lines providing easy access to 3 different Metro stations (Union Station, Stadium/.Armory, and NoMa/Galludet). It is also just 1 block away from a Capital Bikeshare where you can rent a bike and explore the fabulous city of Washington, DC. Street parking is readily available around the building for those with cars, and for those without cars, all of your needs can be met within a just a few blocks. CVS Pharmacy, Safeway Grocery, Aldi Grocery, and several amazing restaurants, bars, and theaters are located close by.",38.904577933192584,98,1,Private room,-76.9797243426019
Real Bed,2,"DC is an amazing town. Plenty to see, tons to do. But it isn't the cheapest place to visit. So staying in a home is a wonderful way to make a great town even better. And having that entire home to yourself makes it all the better.We have a lovely home available for rent. We are in the vibrant H Street Corridor area (also known as Atlas Arts District) - just north of Capital HIll area. Recently identified as one of the top 10 Hipster Neighborhoods in the country (by Forbes Magazine no less), you are walking distance to restaurants, bars and clubs. We are also minutes away from DC's latest attraction - Union Market.You are also within walking distance of a Metro stop (10 minutes to NOMA/Gallaudet on the red line) and several bus lines (X2, D4, 96). You can be in downtown in (literally) minutes and have easy access to other parts of the city. For those of you planning to drive, you can easily find free, street parking.Equally accessible is Union Station (.7 miles), Eastern Market/Capital Hill (1 mile), Congress/The National Mall (1.5 miles), Chinatown (1.8 miles), White House/Downtown DC (2.5 miles) and the National Zoo (4 miles). All are easily accessible via car or public transportation.Our home has 2 bedrooms and 2 1/2 baths. Master bedroom has a California king sized bed. Second bedroom has a queen. The family room has a sofa bed with a queen sized, Tempurpedic mattress (please note: this is not a traditional sofa bed mattress, but a high-end, comfortable mattress). Kitchen has full sized fridge, gas stove/oven, toaster oven, juicer and micro-wave. Full dining room table (seats 6) and living room. We also has a full sized washer/dryer on 2nd floor. Grocery shopping is nearby or you can arrange a delivery via Peapod. Our home has central air for your comfort.We also have DirectTV with premium channels.Our home can comfortably sleep 6 people.There is a deck and backyard as well. The deck has a gas grill as well as a table and seating area. The back yard is shared with the apartment located below the home. The yard and deck area is secure.While no pets will be in the home during your visit, they do live there at other times. For those of you with allergies, please be aware that dogs and a bird normally rule the home.We have received requests about hosting get togethers or larger groups. Please be aware, if you are interested in this option - we are willing to consider it under the following circumstances:-- you are clear about total number of people expected-- no parties past midnight-- no more than 8 overnight guests in total-- you agree to a security deposit to cover potential damage-- you agree to leave our home in the condition you received it-- you assume any responsibilities for damaged or missing items-- party is strictly no-smoking. any smoking is limited to outdoor areas.-- depending on size of get together, you may be asked for an additional usage feeCheck out the pictures for a better sense of the space and to see if our home will meet your needs.Drop us a line if you're interested. We're proud of our home, our town and happy to make your visit more pleasant. We have priced our home so that it offers value for money and you can truly enjoy your DC area visit. We look forward to hearing from you.",38.904331,212,2,Entire home/flat,-76.995804
Real Bed,5,"As featured in Celebrity House Hunters in the Spring of 2012!Search for ""Biz Markie House"" and watch from .45 seconds to 1.16 seconds. It's a short clip of the full show and it shows a portion of the house!Spectacular, one-of-a-kind house situated in a private alley among the three most desirable neighborhoods in DC: Georgetown, Adams Morgan, and Dupont Circle! Two carriage houses combined to produce incomparable living spaces-- approx. 5,220 square feet, which contains a master bedroom suite (on separate floor) with private bathroom and access to rooftop decks. Also, two large bedroom suites each with private bathrooms! Kitchen, dining room, large recreation/billiard room, elevator (yes, elevator!!), mezzanine office/den, lounge, and 2,000 square feet of outdoor space to include a rooftop pool!! The attention of detail and imaginative design is one of a kind!The house is available for small and large gatherings. There is a $20 per person entertainment fee for entertaining non-house guests.We received a 98 out of 100 WalkScore (nearly perfect) for our accesibiity and convenience to nearby amenities!! This gorgeous neighborhood is surrounded by hundreds of restaurants, bars , grocery stores, and everything else you will need just blocks away from the house! --------------------------------------------------------------------------- Check-in: After 3 pm -early check-in based on availability, late evening check can be charged $30 : Check-out: 11 am - late check out based on availability, luggage storage available. ---------------------------------------------------------------------------Cleaning and Supplies: We provide fresh sheets, blankets and towels. There is a weekly cleaning service and fresh towels and linens are provided. Guests coming for 1 or 2 nights should wait our approval before making reservation. ---------------------------------------------------------------------------If you wish the house to be completely empty (without Doug, Haiti (dog), and one in-house staff member), the master suite can be made available based on accommodation expenses of $500 per night , which will be added to the charges.Please contact us and we will respond quickly!We are looking forward to your stay here in DC!!",38.91083907971952,326,5,Entire home/flat,-77.049330682034
Futon,1,"Large one bedroom in Petworth Renovated within the last year Can accommodate up to 4 guests with full bed and queen-sized air mattress.1/2 a block from Georgia Ave./Petworth Metro stationWiFiKey fob entry to secure buildingHardwood floorsGourmet kitchenWalking distance to Columbia Heights and 11th st Restaurants and Bars (Meridian Pint, Maple, Room 11, KBC etc.)",38.93656451103141,132,1,Entire home/flat,-77.02499966840878
Real Bed,2,"Unique townhouse on historic register! Modernist-style 1960s happy home, decorated in bright orange. House has wifi, cable TV, private garden, parking space, and drum kit. Access to outdoor pool in summer.We are super green - natural cleansers, organic sheets, recycling, healthy air, allergy/animal/smoke free. Occupy 1 bedroom & full bathroom (there will be a fun, professional female in the other) for $99 per night, or take entire home with 3 bedrooms & 2 full bathrooms for $199 per night.Walking distance to National Mall, baseball stadium & many museums. Two blocks from Metro, Arena Stage, river front, supermarket, and restaurants. Very quiet, no city noise, a lovely respite from a day in the city!We will equip you with guidebooks, free citywide bicycle rental, and herbal tea.",38.87488032669139,130,3,Private room,-77.01554964503603
Real Bed,1,"In the bustling neighborhood of LeDroit Park, this loft has a lot to offer including options of one or two bedroom or entire apartment access. Located in the heart of downtown DC and steps away from U St., this home welcomes new and old comers to the city.Large bedroom in 2 bedroom loft in the heart of Washington, DC NW corridor. Hardwood floors in amazingly comfortable home with free access to Internet and satellite television. Home is in safe neighborhood and is family and guests freindly. Guests have access to washer and dryer, large living room and kitchen and access to wireless Internet. If applicable, guests also have access to reserved parking space on premises. Very minimal interaction between guests and homeowner. Very safe, walking distance to everything including public transportation, restaurants, and 14th St./U St. nightlife and entertainment. 5 minute walk to world famous Ben's Chili Bowl, frequented regularly by President Obama, in U St. Corridor. Two blocks from Washington Metro Train Station (Yellow line)",38.91577357711429,85,1,Private room,-77.01880028164918
Real Bed,62,"In the bustling neighborhood of LeDroit Park, this loft has a lot to offer including options of one or two bedroom or entire apartment access. Located in the heart of downtown DC and steps away from U St., this home welcomes new and old comers to the city.Very spacious and hardwood floors with access to full kitchen and washer and dryer. Free wireless access and spacious living roomGuests experience full privacyAccess to great restaurants steps away from townhome, access to public transportation two blocks away, and minutes away from U St/14th St corridor for excellent nightlife experienceDC Metro station two blocks away and bus transportation drops off in front of home",38.91384462488196,85,1,Private room,-77.01917654132998
Real Bed,1,"One bedroom, one bath apartment with all the comforts of home. Modern furnishing, hardwood floor, jacuzzi tub, washer and dryer, stainless steel appliances and a fireplace.You can expect a quiet building with a lot of sun.The neighborhood is a blend of families, singles and pets, old residents and new. There is a corner market and convenience store that sells wine and other drinks. A bus stop can be found across the street. Restaurants and entertainment are in working district on the bustling H St corridor. There is also additional restaurants in the Capital Hill area minutes away. Two metro stops can be found within 15-20 minute walk away (Union station and Stadium Armory)",38.894816262324916,81,1,Entire home/flat,-76.98271642603213
Real Bed,2,"Only the Neat Need to Apply.....luxury house with furnished room, has seperate bathroomVery quiet & clean environmentUtilities Included & Cable & HousekeeperPerson needs to be very clean & neat....ie. must take trash out daily, clean bathroom & if use kitchen must clean & sweep.Housekeeper comes every 2 weekslimited storage no cardboard boxes, stuff stored must be in plastic boxes with lids.Kitchen & bathroom fully suppliedLocation: BloomingdaleRed , Ny Ave LineGreen/Yellow, Shaw Howard LineDC Bikeshare, Car 2 Go and Zip CarBus lines at both ends of block at CornerNeighborhood Big Bear Cafe, Yoga Studio, Baccios Pizza, Thai Resturant, Organic marketMarkets:Harris Teter, Safeway and WholefoodsWeekend Farmer's MarketUnion Market -- Farm Fresh, localPlenty Bars & ResturantsGym:VidaDC FitnessSport Club LA (Ritz Carlton)Shopping:Pentagon City MallGeorgetownChinatown: H& M, Zara, Forever 21, Anthropology and many moreChevy ChaseFriendship HeightsTyson",38.91290706758941,131,1,Private room,-77.0110077670875
Real Bed,,"Furnished bedroom in house near Eastern Market and within walking distance of Capitol and Library of Congress. The bedroom has a large walk-in closet, a sitting area, a desk, hardwood floors, exposed brick and a fireplace. Newly remodeled shared bath, spacious kitchen, dining area downstairs. Landscaped front sitting area.",38.88768793871541,65,1,Private room,-76.98904965041811
Real Bed,,"Beautiful house in Mt Pleasant with a private balcony that overlooks a park and is close to Rock Creek Park. House is within walking distance of many great bars and restaurants and to the Metro. Great big kitchen, even bigger record collection, come stay with us!You wanna come to DC and have a good time? Come stay with us! Not only can we provide you with a very beautiful clean room (we have a maid service), but we can show you DC in a way that no other listing on Air B n B can. Mt Pleasant is referred to often as the village in the city because it is by far one of the most beautiful and hip neighborhoods in all of DC. Its a very leafy, green neighborhood full of historic house and close to the Zoo and Rock Creek. Also, the house is very close to the Metro, within 2-3 miles of all the major tourist attractions, and within walking distance of all the very non-touristy bars and restaurants. Our house is so cool that filmmaker Michael Moore once even swung by for a BBQ here (see foto). We are all in our late 20s and can show you a great time in this city. I am an investigative reporter and can talk to you the underbelly of DC politics that you don't see on the news. Cristian studies tailoring as a hobby and is an aspiring shoe maker as well; if you're interested in seeing what DC has to offer both on and off the radar, he's your guy. My roommate Pat is a music promoter and can show you the best spots. Also, Pat is an amazing chef and while the ad doesn't say you are guaranteed a meal, you bet we are going to have an amazing meal if you want it. Also, feel free to use the kitchen to cook yourself. So if you wanna see DC and have a really good time, come stay with us! You won't regret it.",38.93265847363426,36,3,Private room,-77.04351984170634
Real Bed,1,"One bedroom condo in the middle of the best of what Washington D.C. has to offer. The building is situated in between Downtown, Logan Circle, and DuPont Circle neighborhoods. All metro lines are within walking distance. The condo is in the rear of the building, which provides for a private and quiet setting free from street, traffic, and emergency vehicle noise distractions.The bedroom has a large comfortable king sized bed. A custom-ordered Crate & Barrel couch in the living area pulls out into a queen sized bed, or relax in the leather captain chairs and kick your feet up on the ottoman. The condo is cooled and heated by private controlled units and not by building management. Central A/C is installed and not a noisy window unit!There is also an outdoor patio with a grill.This condo has a Walk Score of 97, a Transit Score of 100, and Biker's Score of 92.Parking is not provided, however if you provide me your vehicle information, I can get a temporary permit for you.Don't hesitate to message me any questions that you may have!",38.903432846431734,97,1,Entire home/flat,-77.0291263573027
Real Bed,4,"Single Family Home is very convenient Washington, DC neighborhood ... 16th Street Heights/Petworth. Easy access to Georgetown through Rock Creek Park, to Dupont Circle down 16th Street, to the U-Street corridor down 14th Street or to Silver Spring up Georgia Avenue. Modern house, completely remodeled 10 years ago.",38.95013030095037,114,4,Entire home/flat,-77.02769133674089
Real Bed,2,"This beautifully furnished 2 bedroom Penthouse Condo comfortably sleeps 6; the unit has central air, washer/dryer, fully-equipped kitchen with dishwasher, cable, internet, 1 flat screen TV w/ surround-sound, linens, towels, hair dryer, iron and ironing board, and even heating pads for those sore muscles after a long day of touring DC. The apartment has three balconies that face 7th Street, NW, which feature views of the the Washington Monument. The apartment is located directly above the Chinatown/Gallery Place Metro Stop and is 2 stops from Union Station, 5 stops from National Airport (DCA), and only 2 blocks from the Convention Center.You don’t need a car….you can walk everywhere: one side of the apartment is actually attached to the famous Chinatown Friendship Arch and the other side of the building features a huge Regal Cinema, Haagen Dazs ice cream shop, Clyde’s Restaurant, Lucky Strikes (fun nightlife bowling center with bar and billiards), and the Verizon Center. Outside the doorstep are the museums, restaurants, pubs, Capitol Buildings, Library of Congress, and Department of Energy. Garaged parking is available for an additional fee. Both bedrooms and the living room have balconies that overlook 7th Street w/ monument views. The master bedroom has a king sized bed, en suite bathroom with large soaking tub, and a huge walk-in closet. The second bedroom features a queen sized bed and another huge walk-in closet; a separate hall bathroom with a large soaking tub is right outside the 2nd bedroom door. The unit also features a large leather, queen-sized sleeper sofa; the unit sleeps up to 6 people comfortably. There are great new hip restaurants within a block of the unit to include Buddha Bar, Busboys and Poets, Kushi Sushi bar, Proof, Zengo, Ping Pong, Zola, and Zatinya. If you choose to cook and dine in the penthouse, there is a 24-hour Safeway grocery store within 3 blocks. In addition to full and private use of the apartment, there is also a business center with free fax, copier, scanner, wireless internet connection, formal business conference room, calming massage room, beautifully furnished party room for entertaining, and a large outdoor terrace equipped with dining tables and lounge chairs for outside dining or sunbathing. If you are interested in staying in the lap of Luxury, please fill out your profile so that I may get a little acquainted with you. Tell me why you are visiting DC, how many people in your party, and a little about yourself. Just as we share information and pictures assuring you of what to expect when staying in Luxury we would like to know a bit about all our potential guests just to keep the place wonderful for every guest. For security purposes, if you book, we will require a photocopy of your identification before your visit and a refundable $1,000 security deposit.",38.89862716732337,163,2,Entire home/flat,-77.02114476327708
